<?xml version="1.0" encoding="UTF-8"?>
<!--

    ***************************************************************************
    Copyright (c) 2010 Qcadoo Limited
    Project: Qcadoo MES
    Version: 1.4

    This file is part of Qcadoo.

    Qcadoo is free software; you can redistribute it and/or modify
    it under the terms of the GNU Affero General Public License as published
    by the Free Software Foundation; either version 3 of the License,
    or (at your option) any later version.

    This program is distributed in the hope that it will be useful,
    but WITHOUT ANY WARRANTY; without even the implied warranty
    of MERCHANTABILITY or FITNESS FOR A PARTICULAR PURPOSE.
    See the GNU Affero General Public License for more details.

    You should have received a copy of the GNU Affero General Public License
    along with this program; if not, write to the Free Software
    Foundation, Inc., 51 Franklin St, Fifth Floor, Boston, MA  02110-1301  USA
    ***************************************************************************

-->
<view name="operationalTasksList" modelName="operationalTaskDto"
	  defaultAuthorizationRole="ROLE_PLANNING" menuAccessible="true"
	  xmlns:xsi="http://www.w3.org/2001/XMLSchema-instance" xmlns="http://schema.qcadoo.org/view"
	  xsi:schemaLocation="http://schema.qcadoo.org/view http://schema.qcadoo.org/view.xsd">

	<component type="window" name="window">

		<ribbon>
			<template name="standardGridTemplate" />
		</ribbon>

		<component type="form" name="form" reference="form">
			<component type="gridLayout" name="mainTabGridLayout"
				columns="3" rows="2" hasBorder="false">
				<layoutElement column="1" row="1">
					<component type="lookup" name="productIn" field="productIn"
						reference="productIn">
						<option type="column" name="name" fields="name" link="true"
							width="200" />
						<option type="searchable" value="name,number" />
						<option type="orderable" value="name,number" />

						<option type="expression"
							value="#number + ' - ' + #name" />
						<option type="fieldCode" value="number" />
					</component>
				</layoutElement>
				<layoutElement column="2" row="1">
					<component type="lookup" name="productOut" field="productOut"
						reference="productOut">
						<option type="column" name="name" fields="name" link="true"
							width="200" />

						<option type="searchable" value="name,number" />
						<option type="orderable" value="name,number" />

						<option type="expression"
							value="#number + ' - ' + #name" />
						<option type="fieldCode" value="number" />
					</component>
				</layoutElement>
				<layoutElement column="1" row="2" width="3">
					<component type="grid" name="operationalTasksList"
						reference="grid">
						<option type="column" name="number" fields="number" link="true" width="75" />
						<option type="column" name="name" fields="name" link="true" width="125" />
						<option type="column" name="startDate" fields="startDate" width="100" />
						<option type="column" name="finishDate" fields="finishDate" width="100"/>
						<option type="column" name="staffName" fields="staffName" width="125" />
						<option type="column" name="productionLineName" fields="productionLineName" width="100"/>
						<option type="column" name="workstationName" fields="workstationName" width="100" />

						<option type="order" column="name" direction="asc" />

						<option type="searchable" value="name,number,startDate,finishDate,staffName,productionLineName,workstationName" />
						<option type="orderable" value="name,number,startDate,finishDate,staffName,productionLineName,workstationName" />

						<option type="correspondingView" value="operationalTasks/operationalTaskDetails" />
						<option type="correspondingComponent" value="form" />

						<option type="fullscreen" value="true" />
						<option type="multiselect" value="true" />

						<option type="fixedHeight" value="true" />
						<option type="header" value="false" />
					</component>
				</layoutElement>
			</component>

			<option type="header" value="true" />
		</component>

	</component>

</view>