<?xml version="1.0" encoding="UTF-8"?>

<view xmlns:xsi="http://www.w3.org/2001/XMLSchema-instance" xmlns="http://schema.qcadoo.org/view" 
	xsi:schemaLocation="http://schema.qcadoo.org/view http://schema.qcadoo.org/view.xsd"
	name="operationsList"
	modelName="operation"
	menuAccessible="true">
	
	<component type="window" name="window">
		<ribbon>
			<group template="gridNewCopyAndRemoveAction" />
		</ribbon>
		<component type="grid" name="operations" reference="grid">
			<option type="column" name="number" fields="number" link="true" />
			<option type="column" name="name" fields="name" link="true"
				width="200" />
			<option type="order" column="number" direction="desc" />
			<option type="correspondingView" value="technologies/operationDetails" />
			<option type="correspondingComponent" value="form" />
			<option type="searchable" value="number, name" />
			<option type="orderable" value="number, name" />
			<option type="fullscreen" value="true" />
			<option type="multiselect" value="true" />
		</component>
		<option type="fixedHeight" value="true" />
		<option type="header" value="false" />
	</component>
</view>