<?xml version="1.0" encoding="UTF-8"?>

<view xmlns:xsi="http://www.w3.org/2001/XMLSchema-instance" xmlns="http://schema.qcadoo.org/view" 
	xsi:schemaLocation="http://schema.qcadoo.org/view http://schema.qcadoo.org/view.xsd"
	name="orderGenealogiesList"
	modelPlugin="orders"
	modelName="order">
	
	<component type="window" name="window" reference="window">
		<ribbon>
			<group template="navigation" />
			<group template="gridNewCopyAndRemoveAction"/>
			<group name="autoGenealogy">
				<bigButton name="activeComplete" icon="genealogyClockIcon24.png"
					action="#{order}.fireEvent(autocompleteGenealogy,false);" state="enabled" />
				<bigButton name="lastUsedComplete" icon="genealogyArrowIcon24.png"
					action="#{order}.fireEvent(autocompleteGenealogy,true);" state="enabled" />
			</group>
		</ribbon>
		<component type="form" name="order" reference="order">
			<listener event="autocompleteGenealogy" class="com.qcadoo.mes.genealogies.AutoGenealogyService" method="autocompleteGenealogy" />
		</component>
		<component type="grid" name="genealogies" reference="grid" source="#{order}.genealogies">
			<option type="column" name="batch" fields="batch" link="true" />
			<option type="order" column="batch" direction="desc" />
			<option type="searchable" value="batch" />
			<option type="orderable" value="batch" />
			<option type="correspondingView" value="genealogies/orderGenealogyDetails" />
			<option type="correspondingComponent" value="form" />
			<option type="height" value="100" />
			<option type="fullscreen" value="true" />
		</component>
		<option type="fixedHeight" value="true" />
		<option type="header" value="false" />
	</component>
</view>