<?xml version="1.0" encoding="UTF-8"?>

<view xmlns:xsi="http://www.w3.org/2001/XMLSchema-instance" xmlns="http://schema.qcadoo.org/view" 
	xsi:schemaLocation="http://schema.qcadoo.org/view http://schema.qcadoo.org/view.xsd"
	name="transfers" 
	modelName="transfer" 
	menuAccessible="true">
		<component type="window" name="window">
			<ribbon>
				<group template="gridNewCopyAndRemoveAction" />
			</ribbon>
			<component type="grid" name="grid" reference="grid">
				<option type="column" name="number" fields="number" link="true" width="150" />
				<option type="column" name="type" fields="type" />
				<option type="column" name="date" fields="date" />
				<option type="column" name="from" fields="from" 
				expression="#stockAreas['name']" />
				<option type="column" name="to" fields="to" 
				expression="#stockAreas['name']" />
				<option type="column" name="product" fields="product"
				expression="#product['name']" />
				<option type="column" name="quantity" fields="quantity" />
				<option type="column" name="staff" fields="staff"
				expression="#staff['name']" />
				<option type="order" column="number" direction="asc" />
				<option type="searchable" value="number" />
				<option type="orderable" value="number" />
				<option type="correspondingView" value="materialFlow/transferDetails" />
				<option type="correspondingComponent" value="form" />
				<option type="fullscreen" value="true" />
				<option type="multiselect" value="true" />
			</component>
			<option type="fixedHeight" value="true" />
			<option type="header" value="false" />
		</component>
</view>