<?xml version="1.0" encoding="UTF-8"?>
<!--

    ***************************************************************************
    Copyright (c) 2010 Qcadoo Limited
    Project: Qcadoo MES
    Version: 0.4.10

    This file is part of Qcadoo.

    Qcadoo is free software; you can redistribute it and/or modify
    it under the terms of the GNU Affero General Public License as published
    by the Free Software Foundation; either version 3 of the License,
    or (at your option) any later version.

    This program is distributed in the hope that it will be useful,
    but WITHOUT ANY WARRANTY; without even the implied warranty
    of MERCHANTABILITY or FITNESS FOR A PARTICULAR PURPOSE.
    See the GNU Affero General Public License for more details.

    You should have received a copy of the GNU Affero General Public License
    along with this program; if not, write to the Free Software
    Foundation, Inc., 51 Franklin St, Fifth Floor, Boston, MA  02110-1301  USA
    ***************************************************************************

-->
<view xmlns:xsi="http://www.w3.org/2001/XMLSchema-instance" xmlns="http://schema.qcadoo.org/view" 
	xsi:schemaLocation="http://schema.qcadoo.org/view http://schema.qcadoo.org/view.xsd"
	name="orderGroupOrdersTable"
	modelName="order"
	modelPlugin="orders" >
	
	<component type="window" name="window" reference="window">
		<ribbon>
			<group name="navigation">
			     <bigButton name="select" icon="acceptIcon24.png" state="disabled" >
			         <script>
			             <![CDATA[
			                 this.addOnChangeListener({
			                     onClick: function() {
			                     	#{form}.fireEvent(this, 'prepareConfirmText');
			                     }
			                 });

							#{confirmBoxTextHolder}.addOnChangeListener({
								onSetValue: function(value) {
									#{confirmBoxTextHolder}.performUpdateState();
									if (confirmReAssigment()) {
			                        	#{form}.fireEvent(this, 'addOrdersToGroup');
			                        }
								}
							});
			                 
			                 #{orders}.addOnChangeListener({
			                     onChange: function(selectedArray) {			                         
			                         if(!selectedArray || selectedArray.length == 0) {
			                             this.disable();
			                         } else {
			                             this.enable();
			                         }
			                     }
			                 });                           
			                 
			                 function confirmReAssigment() {
			                 	var message = #{confirmBoxTextHolder}.getValue().content.value;
			                 	if (!message) {
			                 		return false;
			                 	} else if (message != "NULL") {
                                	return confirm(message);
                                }
                                return true;
			                 }
			             ]]>
			         </script>
			     </bigButton>
			     <bigButton name="cancel" icon="cancelIcon24.png" action="#{window}.performBack;" />
			</group>
		</ribbon>
		
		<component type="form" name="orderGroup" reference="orderGroup" defaultVisible="false" >
		</component>
		
		<component type="form" name="orderGroupOrders" reference="form">
			<component type="gridLayout" name="gridLayout" columns="1" rows="2">
				<layoutElement column="1" row="1">
					<component type="grid" name="orders" reference="orders" >
					   <option type="column" name="number" fields="number" width="75" />
					   <option type="column" name="name" fields="name" width="200" />
					   <option type="column" name="orderGroup" fields="orderGroup" expression="#orderGroup != null ? #orderGroup['name'] : ''" width="200" />
					   <option type="column" name="orderGroupId" fields="orderGroup" hidden="true" />
                       <option type="column" name="dateFromShort" fields="dateFrom" width="160" />
                       <option type="column" name="dateToShort" fields="dateTo" width="160" />
                            
                       <option type="searchable" value="number,name,dateFrom,dateTo" />
                       <option type="orderable" value="number,name,dateFrom,dateTo" />
                        
                       <option type="order" column="number" direction="desc" />
                       <option type="multiselect" value="true" />
					</component>
					<component type="textarea" name="confirmBoxTextHolder" reference="confirmBoxTextHolder" defaultVisible="false" />
				</layoutElement>
			</component>
			<option type="header" value="true" />
			<option type="expression" value="#name" />
			<option type="expressionNew" value="#name" />
			
			<listener event="addOrdersToGroup" class="com.qcadoo.mes.orderGroups.OrderGroupsService" method="addOrdersToGroup" />
			<listener event="prepareConfirmText" class="com.qcadoo.mes.orderGroups.OrderGroupsService" method="prepareConfirmText" />
			
		</component>
	</component>
</view>