<?xml version="1.0" encoding="UTF-8"?>
<view xmlns:xsi="http://www.w3.org/2001/XMLSchema-instance" xmlns="http://schema.qcadoo.org/view" 
	xsi:schemaLocation="http://schema.qcadoo.org/view http://schema.qcadoo.org/view.xsd"
	name="simpleMaterialBalanceStockAreasComponentDetails"
	modelName="simpleMaterialBalanceStockAreasComponent">
	
	<component type="window" name="window">
		<ribbon>
			<template name="standardFormTemplate" includeItems="navigation.back, actions.saveBack"/>
		</ribbon>
		<component type="form" name="simpleMaterialBalanceStockAreasComponent"
			reference="form">
			<component type="gridLayout" name="gridLayout" columns="1" rows="1">
				<layoutElement column="1" row="1">
					<component type="lookup" name="stockAreas" field="stockAreas">
						<option type="column" name="name" fields="name" link="true"
							width="200" />
						<option type="searchable" value="number" />
						<option type="orderable" value="number" />
						<option type="expression"
							value="'&lt;b&gt;' + #number + '&lt;/b&gt; - ' + #name" />
						<option type="fieldCode" value="number" />
					</component>
				</layoutElement>
			</component>
			<option type="header" value="true" />
			<option type="expression" value="#name" />
		</component>
	</component>
</view>