<view defaultAuthorizationRole="ROLE_PLANNING" xmlns:xsi="http://www.w3.org/2001/XMLSchema-instance"
      xmlns="http://schema.qcadoo.org/view"
      xsi:schemaLocation="http://schema.qcadoo.org/view http://schema.qcadoo.org/view.xsd"
      name="schedulesList" modelName="schedule" menuAccessible="true">

    <component type="window" name="window" reference="window">
        <ribbon>
            <template name="standardGridTemplate"/>
        </ribbon>

        <component type="grid" name="schedules" reference="grid">
            <option type="column" name="number" fields="number" link="true" width="40"/>
            <option type="column" name="name" fields="name" link="true" width="50"/>
            <option type="column" name="state" fields="state" link="true" width="40"/>
            <option type="column" name="startTime" fields="startTime" width="50"/>
            <option type="column" name="sortOrder" fields="sortOrder" width="60"/>
            <option type="column" name="workstationAssignCriterion" fields="workstationAssignCriterion" width="60"/>
            <option type="column" name="workerAssignCriterion" fields="workerAssignCriterion" width="60"/>
            <option type="column" name="approveTime" fields="approveTime" width="50"/>

            <option type="correspondingView" value="orders/scheduleDetails"/>
            <option type="correspondingComponent" value="form"/>

            <option type="order" column="number" direction="desc"/>

            <option type="searchable"
                    value="name,number,state,startTime,sortOrder,workstationAssignCriterion,workerAssignCriterion,approveTime"/>
            <option type="orderable"
                    value="name,number,state,startTime,sortOrder,workstationAssignCriterion,workerAssignCriterion,approveTime"/>

            <option type="fullscreen" value="true"/>
            <option type="multiselect" value="true"/>
        </component>

        <option type="fixedHeight" value="true"/>
        <option type="header" value="false"/>
    </component>
</view>
