<view name="deliveriesList" modelName="delivery" menuAccessible="true" xmlns:xsi="http://www.w3.org/2001/XMLSchema-instance"
	xmlns="http://schema.qcadoo.org/view" xsi:schemaLocation="http://schema.qcadoo.org/view http://schema.qcadoo.org/view.xsd">
	<component type="window" name="window">
		<ribbon>
			<template name="standardGridTemplate" />
		</ribbon>
		<component type="grid" name="deliveriesList" reference="grid">
			<option type="column" name="number" fields="number" link="true"	/>
			<option type="column" name="name" fields="name" link="true" />
			<option type="column" name="supplier" fields="supplier" expression="supplier['name']" />
			<option type="column" name="deliveryDate" fields="deliveryDate"  />
			<option type="column" name="deliveryDate" fields="deliveryDate"  />
			<option type="column" name="state" fields="state"  />
			<option type="column" name="createDate" fields="createDate"  />
			<option type="order" column="name" direction="asc" />
			<option type="correspondingView" value="deliveries/deliveryDetails" />
			<option type="correspondingComponent" value="form" />
			<option type="searchable" value="name,number" />
			<option type="orderable" value="name,number" />
			<option type="fullscreen" value="true" />
			<option type="multiselect" value="true" />
		</component>
		<option type="fixedHeight" value="true" />
		<option type="header" value="false" />
	</component>
</view>