<!--

    ***************************************************************************
    Copyright (c) 2010 Qcadoo Limited
    Project: Qcadoo MES
    Version: 0.4.10

    This file is part of Qcadoo.

    Qcadoo is free software; you can redistribute it and/or modify
    it under the terms of the GNU Affero General Public License as published
    by the Free Software Foundation; either version 3 of the License,
    or (at your option) any later version.

    This program is distributed in the hope that it will be useful,
    but WITHOUT ANY WARRANTY; without even the implied warranty
    of MERCHANTABILITY or FITNESS FOR A PARTICULAR PURPOSE.
    See the GNU Affero General Public License for more details.

    You should have received a copy of the GNU Affero General Public License
    along with this program; if not, write to the Free Software
    Foundation, Inc., 51 Franklin St, Fifth Floor, Boston, MA  02110-1301  USA
    ***************************************************************************

-->
<view xmlns:xsi="http://www.w3.org/2001/XMLSchema-instance" xmlns="http://schema.qcadoo.org/view"
	xsi:schemaLocation="http://schema.qcadoo.org/view http://schema.qcadoo.org/view.xsd"
	name="basicProductionCountingList" modelName="order" modelPlugin="orders">

	<!-- name="basicProductionCountingList" modelName="basicProductionCounting" 
		menuAccessible="true"> -->

	<component type="window" name="window">
		<ribbon>
			<group template="navigation" />
		</ribbon>
		<component type="form" name="order" reference="order"/>
		<component type="form" name="basicProductionCounting" reference="form">
			<component type="grid" name="countingList" reference="grid"
				source="#{order}.basicProductionCountings">
				<option type="column" name="productNumber" fields="product"
					expression="#product['number']" link="true"/>
				<option type="column" name="productName" fields="product"
					expression="#product['name']" link="true"/>
				<option type="column" name="plannedQuantity" fields="plannedQuantity" />
				<option type="column" name="producedQuantity" fields="producedQuantity" />
				<option type="column" name="usedQuantity" fields="usedQuantity" />
				<option type="column" name="productType" expression="#product['typeOfMaterial']" hidden="true"/>
				<option type="order" column="productType" direction="desc" />
				<option type="correspondingView"
					value="basicProductionCounting/basicProductionCountingDetails" />
				<option type="correspondingComponent" value="form" />
				<option type="paginable" value="false" />
				<option type="fullscreen" value="true" />
				<option type="multiselect" value="true" />
			</component>
			</component>
		<option type="fixedHeight" value="true" />
		<option type="header" value="false" />
		
	</component>
	<hooks>
	<beforeRender
			class="com.qcadoo.mes.basicProductionCounting.BasicProductionCountingService"
			method="setUneditableGridWhenOrderTypeRecordingIsBasic" />
	</hooks>
</view>