<?xml version="1.0" encoding="UTF-8"?>

<view xmlns:xsi="http://www.w3.org/2001/XMLSchema-instance" xmlns="http://schema.qcadoo.org/view" 
	xsi:schemaLocation="http://schema.qcadoo.org/view http://schema.qcadoo.org/view.xsd"
	name="inventoriesList" 
	menuAccessible="true">
		<component type="window" name="window">
			<ribbon>
				<group template="gridNewCopyAndRemoveAction" />
			</ribbon>
			<component type="grid" name="grid" reference="grid">
				<option type="column" name="warehouse" fields="warehouse" />
				<option type="column" name="product" fields="product"
				expression="#product['name']" />
				<option type="column" name="quantity" fields="quantity" />
			</component>
			<option type="fixedHeight" value="true" />
			<option type="header" value="false" />
		</component>
</view>
