<?xml version="1.0" encoding="UTF-8"?>

<view xmlns:xsi="http://www.w3.org/2001/XMLSchema-instance" xmlns="http://schema.qcadoo.org/view" 
	xsi:schemaLocation="http://schema.qcadoo.org/view http://schema.qcadoo.org/view.xsd"
	name="shiftsList" 
	modelName="shift" 
	menuAccessible="true">
	
	<component type="window" name="window">
		<ribbon>
			<template name="standardGridTemplate" />
			<group name="calendar">
				<bigButton name="showCalendar" action="" state="enabled" />
			</group>
		</ribbon>
		<component type="grid" name="shifts" reference="grid">
			<option type="column" name="name" fields="name" link="true" />
			<option type="order" column="name" direction="asc" />
			<option type="searchable" value="name" />
			<option type="orderable" value="name" />
			<option type="correspondingView" value="productionScheduling/shiftDetail" />
			<option type="correspondingComponent" value="form" />
			<option type="deletable" value="false" />
			<option type="creatable" value="false" />
			<option type="fullscreen" value="true" />
			<option type="multiselect" value="true" />
		</component>
		<option type="fixedHeight" value="true" />
		<option type="header" value="false" />
	</component>
</view>